{"channel_key":"gleif_isin_lei","cost":{"basis":"external_anchor_read","cost_units":100},"entity_grains":["instrument","issuer"],"evidence_class":"external_anchor","evidences":[{"from":"isin","predicate":"issued_by","to":"lei"}],"implementation_status":"planned","independence":{"upstream":["anna_dsb","gleif"]},"license":"gleif_and_anna_dsb_public_terms","schema":"capability.v0","temporal_coverage":{"basis":"isin_lei_reference_data","from":"2019-09-30","to":"2026-07-31"}}
