{"channel_key":"openfigi","cost":{"basis":"external_anchor_api","cost_units":100},"entity_grains":["instrument"],"evidence_class":"external_anchor","evidences":[{"from":"cusip","predicate":"maps_to","to":"figi"},{"from":"isin","predicate":"maps_to","to":"figi"},{"from":"figi","predicate":"identifies_same_instrument","to":"instrument"}],"implementation_status":"planned","independence":{"upstream":["bloomberg_openfigi"]},"license":"openfigi_api_terms","schema":"capability.v0","temporal_coverage":{"basis":"current_resolution","from":"2019-09-30","to":"2026-07-31"}}
