{"channel_key":"snowflake://edgar_db.dbt_wrangling_edgar/nport_holdings_authoritative","conformance_receipt":"receipt:blake3:aaaaaaaaaaaaaaaaaaaaaaaaaaaaaaaaaaaaaaaaaaaaaaaaaaaaaaaaaaaaaaaa","cost":{"basis":"bounded_warehouse_read","cost_units":10},"entity_grains":["instrument_observation","instrument"],"evidence_class":"primary_observation","evidences":[{"from":"instrument_observation","predicate":"observes_identifier","to":"cusip"},{"from":"instrument_observation","predicate":"observes_identifier","to":"isin"},{"from":"instrument_observation","predicate":"observes_descriptor","to":"title"},{"from":"instrument_observation","predicate":"observes_descriptor","to":"maturitydt"},{"from":"instrument_observation","predicate":"observes_coupon","to":"annualizedrt"},{"from":"instrument_observation","predicate":"observes_issuer","to":"lei"}],"implementation_status":"shipped","independence":{"upstream":["sec_edgar"]},"license":"sec_public_filing","schema":"capability.v0","temporal_coverage":{"basis":"nport_report_period","from":"2019-09-30","to":"2026-07-31"}}
