{"channel_key":"snowflake://edgar_db.dbt_wrangling_edgar/wrgl_edgar_nport_confirmation__coupon","conformance_receipt":"receipt:blake3:bbbbbbbbbbbbbbbbbbbbbbbbbbbbbbbbbbbbbbbbbbbbbbbbbbbbbbbbbbbbbbbb","cost":{"basis":"bounded_warehouse_read","cost_units":10},"entity_grains":["instrument"],"evidence_class":"corroboration","evidences":[{"from":"security_id","predicate":"within_period_cross_filer_agreement","to":"annualizedrt"}],"implementation_status":"shipped","independence":{"upstream":["sec_edgar"]},"license":"sec_public_filing","schema":"capability.v0","temporal_coverage":{"basis":"nport_report_period","from":"2019-09-30","to":"2026-07-31"}}
