{"channel_key":"gleif_entities","conformance_receipt":"receipt:blake3:cccccccccccccccccccccccccccccccccccccccccccccccccccccccccccccccc","cost":{"basis":"bounded_warehouse_read","cost_units":20},"entity_grains":["issuer"],"evidence_class":"external_anchor","evidences":[{"from":"lei","predicate":"issuer_succession_or_rename","to":"lei"}],"implementation_status":"shipped","independence":{"upstream":["gleif"]},"license":"gleif_public_data_terms","schema":"capability.v0","temporal_coverage":{"basis":"gleif_entity_history","from":"2019-09-30","to":"2026-07-31"}}
